{
  "$id": "urn:no:nav:fpdokgen:etterlys-inntektsmelding",
  "$schema": "https://json-schema.org/draft/2020-12/schema",
  "description": "Dokumentdata for brev etterlys inntektsmelding",
  "type": "object",
  "required": [
    "felles",
    "søknadDato",
    "antallIkkeMottattIM",
    "antallMottattIM",
    "inntektsmeldingerStatus"
  ],
  "$defs": {
    "arbeidsforholdInntektsmelding": {
      "type": "object",
      "required": [
        "arbeidsgiverIdent",
        "arbeidsgiverNavn",
        "erInntektsmeldingMottatt"
      ],
      "properties": {
        "arbeidsgiverIdent": {
          "type": "string"
        },
        "arbeidsgiverNavn": {
          "type": "string"
        },
        "erInntektsmeldingMottatt": {
          "type": "boolean"
        }
      }
    }
  },
  "properties": {
    "felles": {
      "$ref": "classpath:content/templates/schema_felles.json"
    },
    "søknadDato": {
      "type": "string"
    },
    "antallIkkeMottattIM": {
      "type": "number"
    },
    "antallMottattIM": {
      "type": "number"
    },
    "inntektsmeldingerStatus": {
      "type": "array",
      "items": { "$ref": "#/$defs/arbeidsforholdInntektsmelding" }
    }
  }
}
