{
  "felles": {
    "søkerNavn": "Dolly Duck",
    "søkerPersonnummer": "300220 12345",
    "brevDato": "4. april 2020",
    "erKopi": false,
    "harVerge": false,
    "saksnummer": "123456789",
    "ytelseType": "SVP",
    "erUtkast": false
  },
  "søknadDato": "1. april 2020",
  "antallIkkeMottattIM": 1,
  "antallMottattIM": 1,
  "inntektsmeldingerStatus": [
    {
      "arbeidsgiverIdent": "123456789",
      "arbeidsgiverNavn": "Andeby Bank AS",
      "erInntektsmeldingMottatt": false
    },
    {
      "arbeidsgiverIdent": "99999998",
      "arbeidsgiverNavn": "Andeby Vaktmester AS",
      "erInntektsmeldingMottatt": true
    }
  ]
}
