{
  "felles": {
    "søkerNavn": "Dolly Duck",
    "søkerPersonnummer": "300220 12345",
    "brevDato": "4. april 2020",
    "erKopi": false,
    "harVerge": false,
    "saksnummer": "123456789",
    "ytelseType": "FP",
    "erUtkast": false
  },
  "søknadDato": "1. april 2020",
    "antallIkkeMottattIM": 2,
    "antallMottattIM": 2,
    "inntektsmeldingerStatus":[    {
      "arbeidsgiverIdent": "123456789",
      "arbeidsgiverNavn": "Andeby Bank AS",
      "erInntektsmeldingMottatt":false
    },
      {
        "arbeidsgiverIdent": "99999999",
        "arbeidsgiverNavn": "Andeby Vask AS",
        "erInntektsmeldingMottatt":false
      },
      {
        "arbeidsgiverIdent": "99999998",
        "arbeidsgiverNavn": "Andeby Vaktmester AS",
        "erInntektsmeldingMottatt":true
      },
      {
        "arbeidsgiverIdent": "99999997",
        "arbeidsgiverNavn": "Andeby Service AS",
        "erInntektsmeldingMottatt":true
      }
    ]
}
